{
  "schema_version": "jrs-review-run-envelope/0.1.0",
  "engine_version": "0.1.0-validation",
  "codebook_version": "1.0",
  "assurance_layer_version": "0.1.0-local",
  "condition_vocabulary": "review_engine_keys",
  "fixture_id": "SAE-020",
  "fixture_content_hash": "sha256:d76012a6141d903876f1df5e13170f9a69219538494e3fa4b4bbda01210bf396",
  "run_id": "run_ed0cf429b1fd4f3dc65b892c",
  "run_timestamp": "2026-10-10T05:53:31.002Z",
  "execution_mode": "local_mocked",
  "provider_mode": "mocked",
  "provider_invocations": 0,
  "source_identity_status": "candidate_core_matches_git_history",
  "source_identity": {
    "candidate_source_path": "api/v1/review-engine.js",
    "candidate_source_commit": "0177c5184182b5b1f51ff18c80da29f668996e49",
    "candidate_source_blob": "baebb512e5f296e1b41da138b7868aae4b6098fc",
    "repository_head": "97087e915245a15808f121e2263a7385a6bf5a04",
    "working_tree": "modified_uncommitted"
  },
  "test_or_demo_status": "synthetic_engineering_test",
  "release_status": "NO_GO_NOT_VERIFIED",
  "limitations": [
    {
      "id": "L-01",
      "statement": "Source-span verification establishes record presence only: the quoted text occurs in the submitted record at the stated offsets. It does not establish contextual or semantic validity, that the passage supports this finding, or that the underlying decision was justified."
    },
    {
      "id": "L-02",
      "statement": "This run used a synthetic, engineering-authored fixture. It is not independent, real-world, practitioner, buyer or holdout evidence, and it cannot establish accuracy."
    },
    {
      "id": "L-03",
      "statement": "The candidate has not been independently evaluated. Nothing in this run establishes accuracy, validation, legal compliance, security effectiveness, or production readiness."
    },
    {
      "id": "L-04",
      "statement": "Condition identifiers are the Review Engine's own keys. The Engine-to-Codebook mapping is NOT ESTABLISHED, so no finding is a Codebook condition finding."
    },
    {
      "id": "L-05",
      "statement": "Human review is required for every output. This package does not decide whether the underlying decision was correct, justified, fair, approved, or lawful, and it produces no overall pass."
    },
    {
      "id": "L-06",
      "statement": "Candidate output came from a fixed, engineering-authored mock provider response. Model behaviour was not exercised; this run tests how candidate output is handled, not its quality."
    },
    {
      "id": "L-07",
      "statement": "Record controls are lexical pattern detectors that route passages to human review. They make no statement about the person who wrote the record."
    }
  ],
  "human_review_required": true,
  "gate": {
    "decision": "refuse",
    "trigger_codes": [
      "missing_scope_declaration"
    ]
  },
  "findings": {
    "condition_findings": [
      {
        "condition_id": "basis_identification",
        "condition_label": "Basis Identification (Engine key)",
        "outcome": "not_assessed",
        "outcome_basis": "pre_analysis_refusal",
        "candidate_status": "none",
        "explanation": "Not assessed: the record was refused before analysis. See refusals.",
        "explanation_content_class": "no_record_content",
        "source_spans": [],
        "evidence_classification": "no_verified_record_support",
        "limitation": "Source-span verification establishes record presence only: the quoted text occurs in the submitted record at the stated offsets. It does not establish contextual or semantic validity, that the passage supports this finding, or that the underlying decision was justified. Condition identifiers are the Engine's keys, not Codebook conditions.",
        "what_would_change_this_finding": "This condition would be assessed only after the refusal, escalation or execution boundary listed in refusals is resolved."
      },
      {
        "condition_id": "reasoning_traceability",
        "condition_label": "Decision-Process Traceability (Engine key)",
        "outcome": "not_assessed",
        "outcome_basis": "pre_analysis_refusal",
        "candidate_status": "none",
        "explanation": "Not assessed: the record was refused before analysis. See refusals.",
        "explanation_content_class": "no_record_content",
        "source_spans": [],
        "evidence_classification": "no_verified_record_support",
        "limitation": "Source-span verification establishes record presence only: the quoted text occurs in the submitted record at the stated offsets. It does not establish contextual or semantic validity, that the passage supports this finding, or that the underlying decision was justified. Condition identifiers are the Engine's keys, not Codebook conditions.",
        "what_would_change_this_finding": "This condition would be assessed only after the refusal, escalation or execution boundary listed in refusals is resolved."
      },
      {
        "condition_id": "cold_reviewer_clarity",
        "condition_label": "Reconstructability (Engine key)",
        "outcome": "not_assessed",
        "outcome_basis": "pre_analysis_refusal",
        "candidate_status": "none",
        "explanation": "Not assessed: the record was refused before analysis. See refusals.",
        "explanation_content_class": "no_record_content",
        "source_spans": [],
        "evidence_classification": "no_verified_record_support",
        "limitation": "Source-span verification establishes record presence only: the quoted text occurs in the submitted record at the stated offsets. It does not establish contextual or semantic validity, that the passage supports this finding, or that the underlying decision was justified. Condition identifiers are the Engine's keys, not Codebook conditions.",
        "what_would_change_this_finding": "This condition would be assessed only after the refusal, escalation or execution boundary listed in refusals is resolved."
      },
      {
        "condition_id": "accountability_support",
        "condition_label": "Evidentiary Sufficiency (Engine key)",
        "outcome": "not_assessed",
        "outcome_basis": "pre_analysis_refusal",
        "candidate_status": "none",
        "explanation": "Not assessed: the record was refused before analysis. See refusals.",
        "explanation_content_class": "no_record_content",
        "source_spans": [],
        "evidence_classification": "no_verified_record_support",
        "limitation": "Source-span verification establishes record presence only: the quoted text occurs in the submitted record at the stated offsets. It does not establish contextual or semantic validity, that the passage supports this finding, or that the underlying decision was justified. Condition identifiers are the Engine's keys, not Codebook conditions.",
        "what_would_change_this_finding": "This condition would be assessed only after the refusal, escalation or execution boundary listed in refusals is resolved."
      },
      {
        "condition_id": "temporal_reconstructability",
        "condition_label": "Chronology (Engine key)",
        "outcome": "not_assessed",
        "outcome_basis": "pre_analysis_refusal",
        "candidate_status": "none",
        "explanation": "Not assessed: the record was refused before analysis. See refusals.",
        "explanation_content_class": "no_record_content",
        "source_spans": [],
        "evidence_classification": "no_verified_record_support",
        "limitation": "Source-span verification establishes record presence only: the quoted text occurs in the submitted record at the stated offsets. It does not establish contextual or semantic validity, that the passage supports this finding, or that the underlying decision was justified. Condition identifiers are the Engine's keys, not Codebook conditions.",
        "what_would_change_this_finding": "This condition would be assessed only after the refusal, escalation or execution boundary listed in refusals is resolved."
      }
    ],
    "record_controls": []
  },
  "refusals": [
    {
      "code": "missing_scope_declaration",
      "stage": "pre_analysis",
      "disposition": "refuse",
      "category": "scope",
      "boundary": "No scope declaration was supplied, so the record cannot be placed inside the authorized scope. The authorized local scope is completed, non-HR supplier-access exception drafts supplied as synthetic engineering fixtures. No assessment of the record, its author, or the underlying decision was made."
    }
  ],
  "manifest_reference": {
    "produced": false,
    "reason": "No Manifest is produced unless the candidate ran and no condition was downgraded."
  },
  "artifact_hashes": {
    "record": "sha256:ee1cb45e302d254eefc710629ce24a7e01b5611641be31e779dd1cc9130f1976",
    "request": "sha256:82e743c4af0e295ec84b8c677d9cc57df25e33ff42a75aa27d0d614ee56d0459",
    "normalized_output": "sha256:4c94e5e7fcca65a614105341aa0a8698d77284246e073dce8bac17daec68f78c",
    "code": {
      "lib/engine-assurance/candidate-core.mjs": "sha256:cb0e1df14aea31c5a58809b36e0f91d8c951c35f75c75d7916360041b476f45d",
      "lib/engine-assurance/cognitive-controls.mjs": "sha256:b038932dd14e7c926ede70816051badb91989e88f3f185ced08b59f718053cf4",
      "lib/engine-assurance/content-guard.mjs": "sha256:8f0129220b4ed7384b53bb8b6b5673a7fb7070f8c88c128aaac636a4961055a4",
      "lib/engine-assurance/envelope.mjs": "sha256:ea5d1a0d3d0ceb7a9a8f08e06643e547614d1ef8839310a88cdb80698eb5f39f",
      "lib/engine-assurance/network-guard.mjs": "sha256:15dc96038b0f7117d5628158c6fb24283704b06ef815f1f7e0bbc7d50beef093",
      "lib/engine-assurance/provenance.mjs": "sha256:16d6412b866c7a204a2372b7dea2005f6813bddf7c6df36a89bc44f34da9e017",
      "lib/engine-assurance/run.mjs": "sha256:1327fc6ee5377959078a029c1800b19be3476d87924386ef8e17b8acf13975c2",
      "lib/engine-assurance/scope-gate.mjs": "sha256:48bba831c522e5d3bedf21ec07e8aa81af0d25a0b41f5f73af9ea125d0d56535",